{
    "$schema": "../schemas/instances.json",
    "uri": "point.community",
    "short_description": "Поддерживаем манифест свободного общения и приветствуем самоорганизацию: каждый сам за себя решает что писать и что читать (в пределах уголовного кодекса). Инстанс закрыт от незарегистрированых пользователей и поисковых ботов. Основные пользователи - выходцы из Point.IM.",
    "thumbnail": "point.community.png",
    "software": {
        "name": "friendica"
    },
    "users": {
        "total": 34
    },
    "posting": {
        "max_chars": 65000
    },
    "administration": {
        "cloudflare": true
    }
}