{
    "$schema": "../schemas/instances.json",
    "uri": "expired.mentality.rip",
    "short_description": "Expired Mentality или EMR — это дружелюбный инстанс со свободной тематикой и лёгкой модерацией. На выбор несколько оболочек: от стандартных до Soapbox и легковесного Bloat.",
    "thumbnail": "expired.mentality.rip.png",
    "software": {
        "name": "pleroma"
    },
    "users": {
        "total": 206
    },
    "posting": {
        "max_chars": 65535
    },
    "administration": {
        "provider": "Hetzner"
    }
}