{
    "$schema": "../schemas/instances.json",
    "uri": "soc.phreedom.club",
    "short_description": "Клуб \"Свобода\" предоставляет всем желающим альтернативу централизованным корпоративным сервисам. Основные принципы — простота, минимализм и надёжность. ",
    "thumbnail": "soc.phreedom.club.png",
    "software": {
        "name": "pleroma"
    },
    "users": {
        "total": 127
    },
    "posting": {
        "max_chars": 65535,
        "poll_settings": {
            "max_option_chars": 200,
            "max_options": 20,
            "max_expiration": 31536000,
            "min_expiration": 0
        },
        "post_formats": [
            "text/plain",
            "text/html",
            "text/markdown",
            "text/bbcode"
        ],
        "upload_limits": {
            "avatar": 2000000,
            "background": 4000000,
            "banner": 4000000,
            "general": 16000000
        }
    }
}