{
    "$schema": "../schemas/instances.json",
    "uri": "hubzilla.dark-alexandr.net",
    "short_description": "Личный эксперементальный сервер с открытой регистрацией, используются свежие версии софта, часто эксперементальные, никаких гарантий не даю.",
    "software": {
        "name": "hubzilla"
    },
    "users": {
        "total": 14
    },
    "registration": {
        "approval_required": true,
        "available": true,
        "email_required": true
    },
    "administration": {
        "backups_policy": "weekly"
    }
}