{
    "$schema": "../schemas/instances.json",
    "uri": "social.inex.rocks",
    "short_description": "Just a little IT-Brony Mastodon node for friends.",
    "thumbnail": "social.inex.rocks.png",
    "software": {
        "name": "mastodon",
        "version": "3.2.0"
    },
    "users": {
        "total": 42,
        "active_halfyear": 46,
        "active_month": 26
    },
    "administration": {
        "backups_policy": "daily",
        "bus_factor": 2,
        "contact_email": "mastodon@inex.rocks",
        "federation_policies": [
            "https://raw.githubusercontent.com/pixeldesu/fediverse-friendly-moderation-covenant/master/covenant.md"
        ],
        "server_location": 276,
        "provider": "Hetzner"
    },
    "registration": {
        "approval_required": true,
        "available": true,
        "email_required": true,
        "invite_required": true
    },
    "posting": {
        "max_chars": 500,
        "poll_settings": {
            "max_option_chars": 25,
            "max_options": 4
        },
        "post_formats": [
            "text/plain"
        ]
    }
}