{
    "$schema": "../schemas/instances.json",
    "uri": "sect.sunbutt.faith",
    "title": "Celestianism Sect",
    "short_description": "Уютное русскоязычное место в глобальной сети Fediverse для свободного и дружелюбного общения имени Её Величия и Размера — принцессы Селестии.",
    "thumbnail": "sect.sunbutt.faith.png",
    "software": {
        "name": "pleroma",
        "version": "2.2.0-0-gfb0e340-release-2-2-0",
        "repository": "https://git.pleroma.social/pleroma/pleroma"
    },
    "users": {
        "total": 36
    },
    "administration": {
        "backups_policy": "daily",
        "bus_factor": 4,
        "contact_email": "commagray@sunbutt.faith",
        "server_location": 804
    },
    "registration": {
        "approval_required": false,
        "available": true,
        "email_required": true,
        "invite_required": false
    },
    "posting": {
        "max_chars": 5000,
        "poll_settings": {
            "max_option_chars": 200,
            "max_options": 20,
            "max_expiration": 31536000,
            "min_expiration": 0
        },
        "post_formats": [
            "text/plain",
            "text/html",
            "text/markdown",
            "text/bbcode"
        ],
        "upload_limits": {
            "avatar": 2000000,
            "background": 4000000,
            "banner": 4000000,
            "general": 16000000
        }
    }
}