{
    "$schema": "../schemas/instances.json",
    "uri": "ru.social",
    "short_description": "Региональный Российский узел сети Fediverse.",
    "thumbnail": "ru.social.png",
    "software": {
        "name": "mastodon",
        "version": "3.3.0"
    },
    "users": {
        "total": 193
    },
    "posting": {
        "max_chars": 500,
        "poll_settings": {
            "max_option_chars": 25,
            "max_options": 4
        },
        "post_formats": [
            "text/plain"
        ]
    },
    "administration": {
        "provider": "Selectel"
    }
}