{
    "$schema": "../schemas/instances.json",
    "uri": "indiefedi.party",
    "short_description": "Привет! Это indiefedi.party — инстанс Pleroma, созданный с целью разбавить однообразие визуального контента федивёрса. Категорически приветствуются музыканты и причастные. Художников и мемемэйкеров в интернетах — каждый второй, а независимых музыкантов — кот наплакал. You are very welcome, тем более, движок pleroma располагает, цепляй музыку к постам хоть целыми альбомами. Создадим самый музыкальный инстанс!",
    "thumbnail": "indiefedi.party.png",
    "software": {
        "name": "pleroma"
    },
    "users": {
        "total": 48
    },
    "posting": {
        "max_chars": 50000
    },
    "administration": {
        "provider": "OVH SAS"
    }
}