{
    "$schema": "../schemas/instances.json",
    "uri": "mstdn.netwhood.online",
    "short_description": "Network neighborhood / Сетевое соседство это открытое сообщество людей, увлекающихся средствами коммуникаций, сетями связи, информационными системами, программированием, и в целом всем, что так или иначе связано с информацией, её движением и влиянием на нашу жизнь.",
    "thumbnail": "mstdn.netwhood.online.png",
    "software": {
        "name": "mastodon",
        "version": "3.2.0"
    },
    "users": {
        "total": 126
    },
    "posting": {
        "max_chars": 500,
        "poll_settings": {
            "max_option_chars": 25,
            "max_options": 4
        },
        "post_formats": [
            "text/plain"
        ]
    },
    "administration": {
        "provider": "OVH SAS"
    }
}